{
  "blockers": [
    "explicit_abort"
  ],
  "canonical_result": null,
  "contract": {
    "id": "fixture_append.v1",
    "package_digest": "sha256:27c1ca9d41c4d5c5c7f31095ea9eb1c411c5d4b609f2b03c3124bb0f574462b8",
    "version": "1.0.0"
  },
  "core": {
    "id": "phase.core",
    "package_digest": "sha256:0db2d0834d134a315ce41a8335a35dcbd411a176d1dbd0f2a212d38ae935bc30",
    "version": "1.0.0"
  },
  "effect_receipts": [],
  "evidence": {
    "attachment_digests": [],
    "finalization_status": "finalized",
    "intent_digest": "sha256:282bcbc3f0a34a8a4ac6f00c276fcf66cf3757a3332e83d92208e5079af46922",
    "receipt_digest_policy_id": "digest.receipt_v1",
    "required_attachments_present": true
  },
  "execution_disposition": "not_executed",
  "exit_code": 11,
  "finished_at": "2026-07-26T14:00:01Z",
  "mutation_attempted": false,
  "phase_receipt_version": "1.0",
  "prior_verified_receipt_digest": null,
  "recovery_required": false,
  "result_state": "none",
  "retry_disposition": "forbidden",
  "run_id": "golden-run-001",
  "started_at": "2026-07-26T14:00:00Z",
  "terminal_status": "aborted",
  "validator_results": []
}
